,@context,@type,Condition,Location,Options,bodyType,brand,color,description,driveWheelConfiguration,image,manufacturer,mileageFromOdometer_@type,mileageFromOdometer_value,model,name,offers_@type,offers_availability,offers_itemCondition,offers_price,offers_priceCurrency,productionDate,url,vehicleEngine,vehicleIdentificationNumber,vehicleInteriorColor,vehicleTransmission
526,http://schema.org/,Car,Used,"New York, NY","ABS Brakes (4-Wheel), Air Conditioning - Front, Airbags - Front - Dual, Audio - Radio: AM/FM, Center Console, Clock, Exterior Mirrors Power",Van,Ford,Red,"Location: New York, NY. This 2003 Ford E-250 and Econoline 250 includes ABS Brakes (4-Wheel), Air Conditioning - Front, Airbags - Front - Dual, Audio - Radio: AM/FM, Center Console, Clock, Exterior Mirrors Power",2 wheel drive - rear,https://images.autotrader.com/hn/c/c972d9ce8dc04bcfb9ca7c72304f6ad1.jpg,Ford,QuantitativeValue,246614,E-250 and Econoline 250,Used 2003 Ford E-250 and Econoline 250,Offer,http://schema.org/InStock,http://schema.org/UsedCondition,4495,USD,2003,https://www.autotrader.com/cars-for-sale/vehicledetails.xhtml?listingId=374418199,8-Cylinder,1FTNE24L53HA33671,,Automatic
527,http://schema.org/,Car,Used,"New York, NY","AM/FM Radio, Air Conditioning, Anti-Lock Braking System (ABS), Center Console, Chrome Bumper(s), Clock, Dual Air Bags, Intermittent Wipers, Power Steering",Truck,Dodge,Blue,"Location: New York, NY. This 2003 Dodge Ram 1500 Truck includes AM/FM Radio, Air Conditioning, Anti-Lock Braking System (ABS), Center Console, Chrome Bumper(s), Clock, Dual Air Bags, Intermittent Wipers, Power Steering",2 wheel drive - rear,https://images.autotrader.com/hn/c/8363aa8c90c6492f934bff15018a3e4c.jpg,Dodge,QuantitativeValue,122000,Ram 1500 Truck,Used 2003 Dodge Ram 1500 Truck ST,Offer,http://schema.org/InStock,http://schema.org/UsedCondition,0,USD,2003,https://www.autotrader.com/cars-for-sale/vehicledetails.xhtml?listingId=281587526,6-Cylinder,1D7HA16K43J638285,,Automatic
528,http://schema.org/,Car,Used,"New York, NY","& 6-way power driver & front passenger seats, 17"" x 8.5"" (43.2 cm x 21.6 cm), 18.0 gallon fuel tank, 2.73 ratio, 360 lb.-ft. [486.0 N-m] @ 4000 rpm for automatic transmission)",Convertible,Chevrolet,Red,"Location: New York, NY. This 2003 Chevrolet Corvette includes & 6-way power driver & front passenger seats, 17"" x 8.5"" (43.2 cm x 21.6 cm), 18.0 gallon fuel tank, 2.73 ratio, 360 lb.-ft. [486.0 N-m] @ 4000 rpm for automatic transmission)",2 wheel drive - rear,https://images.autotrader.com/hn/c/c44eae5c57044deaa7902c7439b06565.jpg,Chevrolet,QuantitativeValue,71861,Corvette,Used 2003 Chevrolet Corvette Convertible,Offer,http://schema.org/InStock,http://schema.org/UsedCondition,16990,USD,2003,https://www.autotrader.com/cars-for-sale/vehicledetails.xhtml?listingId=534910106,8-Cylinder,1G1YY32G035126608,Tan,Automatic
529,http://schema.org/,Car,Used,"New York, NY","Center Console, Cruise Control, Daytime Running Lights, Driver Seat Power Adjustments, Exterior Entry Lights, Front Air Conditioning, Front Air Conditioning - Automatic Climate Control",Sedan,BMW,Black,"Location: New York, NY. This 2003 BMW 330xi includes Center Console, Cruise Control, Daytime Running Lights, Driver Seat Power Adjustments, Exterior Entry Lights, Front Air Conditioning, Front Air Conditioning - Automatic Climate Control",All wheel drive,https://images.autotrader.com/hn/c/b7293e521fcb4257b0b39b8ad3d130c8.jpg,BMW,QuantitativeValue,110977,330xi,Used 2003 BMW 330xi Sedan,Offer,http://schema.org/InStock,http://schema.org/UsedCondition,5995,USD,2003,https://www.autotrader.com/cars-for-sale/vehicledetails.xhtml?listingId=454122759,6-Cylinder,WBAEW53443PG22354,Black,Automatic
530,http://schema.org/,Car,Used,"New York, NY","Abs - 4-Wheel, Anti-Theft System - Alarm, Center Console, Clock, Cruise Control, Daytime Running Lights, Dimming Rearview Mirror - Auto, Driver Seat Power Adjustments",Sedan,Lexus,Silver,"Location: New York, NY. This 2003 Lexus GS 300 includes Abs - 4-Wheel, Anti-Theft System - Alarm, Center Console, Clock, Cruise Control, Daytime Running Lights, Dimming Rearview Mirror - Auto, Driver Seat Power Adjustments",2 wheel drive - rear,https://images.autotrader.com/hn/c/0683635ed074451ca5ad518c224f6662.jpg,Lexus,QuantitativeValue,130214,GS 300,Used 2003 Lexus GS 300,Offer,http://schema.org/InStock,http://schema.org/UsedCondition,4995,USD,2003,https://www.autotrader.com/cars-for-sale/vehicledetails.xhtml?listingId=523172644,6-Cylinder,JT8BD69S930182191,Gray,Automatic
531,http://schema.org/,Car,Used,"New York, NY","Abs - Rear, Axle Ratio - 3.55, Center Console, Clock, Cruise Control, Exterior Entry Lights, Front Air Conditioning, Front Airbags - Dual, Front Bumper Color - Chrome",Truck,Dodge,Blue,"Location: New York, NY. This 2003 Dodge Ram 1500 Truck includes Abs - Rear, Axle Ratio - 3.55, Center Console, Clock, Cruise Control, Exterior Entry Lights, Front Air Conditioning, Front Airbags - Dual, Front Bumper Color - Chrome",4 wheel drive - rear wheel default,https://images.autotrader.com/hn/c/8888c6b206fa4548ac3b12f1b681484e.jpg,Dodge,QuantitativeValue,188419,Ram 1500 Truck,Used 2003 Dodge Ram 1500 Truck 4x4 Regular Cab,Offer,http://schema.org/InStock,http://schema.org/UsedCondition,4995,USD,2003,https://www.autotrader.com/cars-for-sale/vehicledetails.xhtml?listingId=536586393,8-Cylinder,1D7HU16D43J607692,Black,Automatic
532,http://schema.org/,Car,Used,"New York, NY","Abs - 4-Wheel, Cassette, Center Console, Clock, Cruise Control, Daytime Running Lights, Exterior Entry Lights, Front Air Conditioning, Front Airbags - Dual",Sedan,Toyota,Tan,"Location: New York, NY. This 2003 Toyota Camry includes Abs - 4-Wheel, Cassette, Center Console, Clock, Cruise Control, Daytime Running Lights, Exterior Entry Lights, Front Air Conditioning, Front Airbags - Dual",2 wheel drive - front,https://images.autotrader.com/hn/c/a5555dd57ddf4899a59fa1ff3f5f19b8.jpg,Toyota,QuantitativeValue,105646,Camry,Used 2003 Toyota Camry SE V6,Offer,http://schema.org/InStock,http://schema.org/UsedCondition,4750,USD,2003,https://www.autotrader.com/cars-for-sale/vehicledetails.xhtml?listingId=456094276,6-Cylinder,4T1BF32K63U552179,Tan,Automatic
533,http://schema.org/,Car,Used,"New York, NY","Abs - 4-Wheel, Anti-Theft System - Alarm, Cassette, Center Console, Clock, Cruise Control, Daytime Running Lights, Driver Seat Power Adjustments - 8",Sedan,Cadillac,Black,"Location: New York, NY. This 2003 Cadillac CTS includes Abs - 4-Wheel, Anti-Theft System - Alarm, Cassette, Center Console, Clock, Cruise Control, Daytime Running Lights, Driver Seat Power Adjustments - 8",2 wheel drive - rear,https://images.autotrader.com/hn/c/e80062dcfd50489cb0ead5a4e8c90e60.jpg,Cadillac,QuantitativeValue,105562,CTS,Used 2003 Cadillac CTS 3.2,Offer,http://schema.org/InStock,http://schema.org/UsedCondition,4450,USD,2003,https://www.autotrader.com/cars-for-sale/vehicledetails.xhtml?listingId=540089090,6-Cylinder,1G6DM57N930106989,Black,Manual
534,http://schema.org/,Car,Used,"New York, NY","Abs - 4-Wheel, Anti-Theft System - Alarm, Cassette, Center Console, Clock, Cruise Control, Driver Seat Power Adjustments, Exterior Entry Lights",Sedan,Nissan,Silver,"Location: New York, NY. This 2003 Nissan Maxima includes Abs - 4-Wheel, Anti-Theft System - Alarm, Cassette, Center Console, Clock, Cruise Control, Driver Seat Power Adjustments, Exterior Entry Lights",2 wheel drive - front,https://images.autotrader.com/hn/c/a56810451fe94ed2bd649f22fc2ccd7f.jpg,Nissan,QuantitativeValue,113996,Maxima,Used 2003 Nissan Maxima SE,Offer,http://schema.org/InStock,http://schema.org/UsedCondition,2995,USD,2003,https://www.autotrader.com/cars-for-sale/vehicledetails.xhtml?listingId=533851489,6-Cylinder,JN1DA31A23T407539,Black,Automatic
535,http://schema.org/,Car,Used,"New York, NY","Abs - 4-Wheel, Clock, Cruise Control, Exterior Entry Lights, Front Airbags - Dual, Front Seat Type - Bucket, Front Wipers - Intermittent, Gauge - Tachometer",Coupe,Honda,Black,"Location: New York, NY. This 2003 Honda Civic includes Abs - 4-Wheel, Clock, Cruise Control, Exterior Entry Lights, Front Airbags - Dual, Front Seat Type - Bucket, Front Wipers - Intermittent, Gauge - Tachometer",2 wheel drive - front,https://images.autotrader.com/hn/c/b567773986484b4ca92b1a62ff1e70f6.jpg,Honda,QuantitativeValue,204015,Civic,Used 2003 Honda Civic EX Coupe,Offer,http://schema.org/InStock,http://schema.org/UsedCondition,2450,USD,2003,https://www.autotrader.com/cars-for-sale/vehicledetails.xhtml?listingId=524737230,4-Cylinder,1HGEM22943L048039,Gray,Automatic
536,http://schema.org/,Car,Used,"New York, NY","Cassette, Center Console, Clock, Cruise Control, Daytime Running Lights, Front Air Conditioning, Front Airbags - Dual, Front Seat Type - Bucket",Sedan,Toyota,Tan,"Location: New York, NY. This 2003 Toyota Camry includes Cassette, Center Console, Clock, Cruise Control, Daytime Running Lights, Front Air Conditioning, Front Airbags - Dual, Front Seat Type - Bucket",2 wheel drive - front,https://images.autotrader.com/hn/c/d8782f3eb25c4bd6826a6fa0dd87c45d.jpg,Toyota,QuantitativeValue,143530,Camry,Used 2003 Toyota Camry LE Sedan,Offer,http://schema.org/InStock,http://schema.org/UsedCondition,4400,USD,2003,https://www.autotrader.com/cars-for-sale/vehicledetails.xhtml?listingId=539461563,4-Cylinder,4T1BE32KX3U766837,Tan,Automatic
537,http://schema.org/,Car,Used,"New York, NY","4-Wheel Disc Brakes, A/C, ABS, AM/FM Stereo, Adjustable Steering Wheel, Aluminum Wheels, Bucket Seats, CD Player, Cruise Control, Daytime Running Lights",Sedan,Oldsmobile,White,"Location: New York, NY. This 2003 Oldsmobile Alero includes 4-Wheel Disc Brakes, A/C, ABS, AM/FM Stereo, Adjustable Steering Wheel, Aluminum Wheels, Bucket Seats, CD Player, Cruise Control, Daytime Running Lights",2 wheel drive - front,https://images.autotrader.com/hn/c/4fc178033a134f28aef54f55f061900c.jpg,Oldsmobile,QuantitativeValue,68982,Alero,Used 2003 Oldsmobile Alero GLS Sedan,Offer,http://schema.org/InStock,http://schema.org/UsedCondition,3434,USD,2003,https://www.autotrader.com/cars-for-sale/vehicledetails.xhtml?listingId=537400019,6-Cylinder,1G3NF52E63C280519,Neutral,Automatic
538,http://schema.org/,Car,Used,"New York, NY","3.55 Axle Ratio, 4 Speakers, 4-Wheel Disc Brakes, 420 lbs Payload Package, ABS brakes, AM/FM radio, Air Conditioning, Auto-dimming Rear-View mirror",Sport Utility,Ford,White,"Location: New York, NY. This 2003 Ford Explorer includes 3.55 Axle Ratio, 4 Speakers, 4-Wheel Disc Brakes, 420 lbs Payload Package, ABS brakes, AM/FM radio, Air Conditioning, Auto-dimming Rear-View mirror",4 wheel drive,https://images.autotrader.com/hn/c/a70ed035c7e74a39a78f4abbd45c4958.jpg,Ford,QuantitativeValue,,Explorer,Used 2003 Ford Explorer XLT,Offer,http://schema.org/InStock,http://schema.org/UsedCondition,0,USD,2003,https://www.autotrader.com/cars-for-sale/vehicledetails.xhtml?listingId=542411957,6-Cylinder,1FMZU73K93UB05050,,Automatic
539,http://schema.org/,Car,Used,"New York, NY","Abs - 4-Wheel, Axle Ratio - 3.73, Cassette, Center Console, Clock, Cruise Control, Exterior Entry Lights, Front Air Conditioning, Front Airbags - Dual",Truck,Ford,Red,"Location: New York, NY. This 2003 Ford F250 includes Abs - 4-Wheel, Axle Ratio - 3.73, Cassette, Center Console, Clock, Cruise Control, Exterior Entry Lights, Front Air Conditioning, Front Airbags - Dual",4 wheel drive - rear wheel default,https://images.autotrader.com/hn/c/c6ce37aa620b45d7ae80f36bd134509c.jpg,Ford,QuantitativeValue,213532,F250,Used 2003 Ford F250 4x4 Crew Cab XLT,Offer,http://schema.org/InStock,http://schema.org/UsedCondition,12888,USD,2003,https://www.autotrader.com/cars-for-sale/vehicledetails.xhtml?listingId=539764627,8-Cylinder Turbo,1FTNW21P53EB63200,Gray,Automatic
540,http://schema.org/,Car,Used,"New York, NY","Axle Ratio - 3.73, Cassette, Center Console, Clearance Lights, Clock, Cruise Control, Exterior Entry Lights, Front Air Conditioning, Front Airbags - Dual",Truck,Ford,Black,"Location: New York, NY. This 2003 Ford F350 includes Axle Ratio - 3.73, Cassette, Center Console, Clearance Lights, Clock, Cruise Control, Exterior Entry Lights, Front Air Conditioning, Front Airbags - Dual",4 wheel drive - rear wheel default,https://images.autotrader.com/hn/c/da835c7ebf6142aaac7a491fe4bbf0a0.jpg,Ford,QuantitativeValue,179606,F350,Used 2003 Ford F350 4x4 SuperCab XLT DRW,Offer,http://schema.org/InStock,http://schema.org/UsedCondition,11998,USD,2003,https://www.autotrader.com/cars-for-sale/vehicledetails.xhtml?listingId=537333804,8-Cylinder Turbo,1FTWX33P93EC49937,Black,Automatic
541,http://schema.org/,Car,Used,"New York, NY","AM/FM Stereo Radio, Air Conditioning, Alloy Wheels, Anti-Lock Braking System (ABS), Bucket Seats, CD Player, Carpeting, Center Console, Coolant Temp. Gauge",Sedan,BMW,White,"Location: New York, NY. This 2003 BMW 325xi includes AM/FM Stereo Radio, Air Conditioning, Alloy Wheels, Anti-Lock Braking System (ABS), Bucket Seats, CD Player, Carpeting, Center Console, Coolant Temp. Gauge",All wheel drive,https://images.autotrader.com/hn/c/979fec8f9c194fcab75c58cd86fe9a1c.jpg,BMW,QuantitativeValue,102300,325xi,Used 2003 BMW 325xi Sedan,Offer,http://schema.org/InStock,http://schema.org/UsedCondition,11450,USD,2003,https://www.autotrader.com/cars-for-sale/vehicledetails.xhtml?listingId=450843683,6-Cylinder,WBAEU33453PM53842,Sand,Automatic
542,http://schema.org/,Car,Used,"New York, NY","AM/FM Stereo Radio, Air Conditioning, Alloy Wheels, Anti-Lock Braking System (ABS), Bucket Seats, CD Player, Carpeting, Center Console, Coolant Temp. Gauge",Sedan,BMW,Black,"Location: New York, NY. This 2003 BMW 325xi includes AM/FM Stereo Radio, Air Conditioning, Alloy Wheels, Anti-Lock Braking System (ABS), Bucket Seats, CD Player, Carpeting, Center Console, Coolant Temp. Gauge",All wheel drive,https://images.autotrader.com/hn/c/cff739b7922c407ca31011a5357a5b7e.jpg,BMW,QuantitativeValue,122387,325xi,Used 2003 BMW 325xi Sedan,Offer,http://schema.org/InStock,http://schema.org/UsedCondition,10250,USD,2003,https://www.autotrader.com/cars-for-sale/vehicledetails.xhtml?listingId=373944366,6-Cylinder,WBAEU33493PM52225,Sand,Automatic
543,http://schema.org/,Car,Used,"New York, NY","AM/FM Radio, Air Conditioning, Audio Cassette Player, Auto Express Down Window, Automatic Transmission, Bucket Seats, CD Player in Dash, Center Console",Sedan,MAZDA,Silver,"Location: New York, NY. This 2003 MAZDA Protege includes AM/FM Radio, Air Conditioning, Audio Cassette Player, Auto Express Down Window, Automatic Transmission, Bucket Seats, CD Player in Dash, Center Console",2 wheel drive - front,https://images.autotrader.com/hn/c/85886aa760924d58917cd32bc29ccc0a.jpg,MAZDA,QuantitativeValue,108080,Protege,Used 2003 MAZDA Protege LX,Offer,http://schema.org/InStock,http://schema.org/UsedCondition,8995,USD,2003,https://www.autotrader.com/cars-for-sale/vehicledetails.xhtml?listingId=507072400,4-Cylinder,JM1BJ225331161452,Off Black,Automatic
544,http://schema.org/,Car,Used,"New York, NY","AM/FM Radio, Air Conditioning, Alloy Wheels, Anti Theft/Security System, Anti-Lock Braking System (ABS), Auto Express Down Window, Bucket Seats",Hatchback,Acura,Silver,"Location: New York, NY. This 2003 Acura RSX includes AM/FM Radio, Air Conditioning, Alloy Wheels, Anti Theft/Security System, Anti-Lock Braking System (ABS), Auto Express Down Window, Bucket Seats",2 wheel drive - front,https://images.autotrader.com/hn/c/7c253bd97d2149039f3f0acfe4a73ef2.jpg,Acura,QuantitativeValue,97501,RSX,Used 2003 Acura RSX,Offer,http://schema.org/InStock,http://schema.org/UsedCondition,7995,USD,2003,https://www.autotrader.com/cars-for-sale/vehicledetails.xhtml?listingId=329958365,4-Cylinder,JH4DC54833S000507,Ebony,Automatic
545,http://schema.org/,Car,Used,"New York, NY","AM/FM Stereo Radio, Air Conditioning, Alloy Wheels, Bucket Seats, CD Player, Carpeting, Cassette Player, Center Console, Clock, Cloth/Vinyl Upholstery",Hatchback,Toyota,Black,"Location: New York, NY. This 2003 Toyota Celica includes AM/FM Stereo Radio, Air Conditioning, Alloy Wheels, Bucket Seats, CD Player, Carpeting, Cassette Player, Center Console, Clock, Cloth/Vinyl Upholstery",2 wheel drive - front,https://images.autotrader.com/hn/c/8ef4de72511c46749c00982a26474ba6.jpg,Toyota,QuantitativeValue,155004,Celica,Used 2003 Toyota Celica GT,Offer,http://schema.org/InStock,http://schema.org/UsedCondition,7850,USD,2003,https://www.autotrader.com/cars-for-sale/vehicledetails.xhtml?listingId=450843542,4-Cylinder,JTDDR32T030143261,Blackblack,Automatic
546,http://schema.org/,Car,Used,"New York, NY","AM/FM Stereo Radio, Air Conditioning, Alloy Wheels, Bucket Seats, CD Player, Carpeting, Center Console, Clock, Cloth Upholstery, Coolant Temp. Gauge",Sedan,Nissan,Blue,"Location: New York, NY. This 2003 Nissan Sentra includes AM/FM Stereo Radio, Air Conditioning, Alloy Wheels, Bucket Seats, CD Player, Carpeting, Center Console, Clock, Cloth Upholstery, Coolant Temp. Gauge",2 wheel drive - front,https://images.autotrader.com/hn/c/67424b4c4a6b451bbc2afa89269c8461.jpg,Nissan,QuantitativeValue,136929,Sentra,Used 2003 Nissan Sentra SE-R Spec V,Offer,http://schema.org/InStock,http://schema.org/UsedCondition,7500,USD,2003,https://www.autotrader.com/cars-for-sale/vehicledetails.xhtml?listingId=450843592,4-Cylinder,3N1AB51D63L718515,Black,Manual
547,http://schema.org/,Car,Used,"New York, NY","12 V Powerpoint, AM/FM Radio, Air Conditioning, Anti-Lock Braking System (ABS), Auto Express Down Window, Clock, Cloth Upholstery, Coolant Temp. Gauge",Van,Chevrolet,White,"Location: New York, NY. This 2003 Chevrolet Venture includes 12 V Powerpoint, AM/FM Radio, Air Conditioning, Anti-Lock Braking System (ABS), Auto Express Down Window, Clock, Cloth Upholstery, Coolant Temp. Gauge",2 wheel drive - front,https://images.autotrader.com/hn/c/64a0194c36a94d60874b13ba94b43264.jpg,Chevrolet,QuantitativeValue,137325,Venture,Used 2003 Chevrolet Venture Extended,Offer,http://schema.org/InStock,http://schema.org/UsedCondition,5995,USD,2003,https://www.autotrader.com/cars-for-sale/vehicledetails.xhtml?listingId=450843651,6-Cylinder,1GBDX23EX3D319438,Gray,Automatic
548,http://schema.org/,Car,Used,"New York, NY","(2) cup holders, (2) pwr points, (8) speakers, 17 mini spare wheel/tire, 18 gallon fuel tank w/tethered cap, 2-speed variable intermittent windshield wipers w/heated wiper park",Convertible,Ford,Black,"Location: New York, NY. This 2003 Ford Thunderbird includes (2) cup holders, (2) pwr points, (8) speakers, 17 mini spare wheel/tire, 18 gallon fuel tank w/tethered cap, 2-speed variable intermittent windshield wipers w/heated wiper park",2 wheel drive - rear,https://images.autotrader.com/hn/c/bd71ee1659f949fdac7dd1be5e958930.jpg,Ford,QuantitativeValue,47359,Thunderbird,Used 2003 Ford Thunderbird,Offer,http://schema.org/InStock,http://schema.org/UsedCondition,17000,USD,2003,https://www.autotrader.com/cars-for-sale/vehicledetails.xhtml?listingId=483382880,8-Cylinder,1FAHP60A23Y104754,Black Ink,Automatic
549,http://schema.org/,Car,Used,"New York, NY","4-Wheel Disc Brakes, A/C, ABS, AM/FM Stereo, Aluminum Wheels, Brake Assist, Bucket Seats, Cassette, Convertible Hardtop, Cruise Control, Driver Air Bag",Convertible,Mercedes-Benz,Silver,"Location: New York, NY. This 2003 Mercedes-Benz SLK 230 includes 4-Wheel Disc Brakes, A/C, ABS, AM/FM Stereo, Aluminum Wheels, Brake Assist, Bucket Seats, Cassette, Convertible Hardtop, Cruise Control, Driver Air Bag",2 wheel drive - rear,https://images.autotrader.com/hn/c/148865398eb74df5bf1d90210635e36a.jpg,Mercedes-Benz,QuantitativeValue,66308,SLK 230,Used 2003 Mercedes-Benz SLK 230,Offer,http://schema.org/InStock,http://schema.org/UsedCondition,7589,USD,2003,https://www.autotrader.com/cars-for-sale/vehicledetails.xhtml?listingId=536447578,4-Cylinder Supercharged,WDBKK49F53F285506,Crimson Red,Manual
550,http://schema.org/,Car,Used,"New York, NY","4-Wheel Disc Brakes, A/C, ABS, AM/FM Stereo, Adjustable Steering Wheel, Aluminum Wheels, Automatic Headlights, Bucket Seats, CARGO CONVENIENCE NET  TRUNK",Sedan,Chevrolet,Burgundy,"Location: New York, NY. This 2003 Chevrolet Impala includes 4-Wheel Disc Brakes, A/C, ABS, AM/FM Stereo, Adjustable Steering Wheel, Aluminum Wheels, Automatic Headlights, Bucket Seats, CARGO CONVENIENCE NET  TRUNK",2 wheel drive - front,,Chevrolet,QuantitativeValue,82711,Impala,Used 2003 Chevrolet Impala LS,Offer,http://schema.org/InStock,http://schema.org/UsedCondition,0,USD,2003,https://www.autotrader.com/cars-for-sale/vehicledetails.xhtml?listingId=534130510,6-Cylinder,2G1WH55KX39400712,Medium Gray,Automatic
551,http://schema.org/,Car,Used,"New York, NY","4-Wheel Disc Brakes, A/C, ABS, AM/FM Stereo, Aluminum Wheels, Bucket Seats, CD Player, Convertible Hardtop, Cruise Control, DRIVER CONVENIENCE PACKAGE   ",Truck,Chevrolet,Red,"Location: New York, NY. This 2003 Chevrolet SSR includes 4-Wheel Disc Brakes, A/C, ABS, AM/FM Stereo, Aluminum Wheels, Bucket Seats, CD Player, Convertible Hardtop, Cruise Control, DRIVER CONVENIENCE PACKAGE   includes heated driver and front passenger seats and driver's memory seat",2 wheel drive - rear,,Chevrolet,QuantitativeValue,50644,SSR,Used 2003 Chevrolet SSR,Offer,http://schema.org/InStock,http://schema.org/UsedCondition,0,USD,2003,https://www.autotrader.com/cars-for-sale/vehicledetails.xhtml?listingId=530846447,8-Cylinder,1GCES14P73B102059,Ebony,Automatic
552,http://schema.org/,Car,Certified,"New York, NY","11 Speakers, 4-Wheel Disc Brakes, 4.677 Axle Ratio, ABS brakes, AM/FM radio, Air Conditioning, Anti-whiplash front head restraints, Auto-dimming Rear-View mirror",Sport Utility,Nissan,Gray,"Location: New York, NY. This 2015 Nissan Murano includes 11 Speakers, 4-Wheel Disc Brakes, 4.677 Axle Ratio, ABS brakes, AM/FM radio, Air Conditioning, Anti-whiplash front head restraints, Auto-dimming Rear-View mirror",All wheel drive,https://images.autotrader.com/hn/c/cf59cc925216457e926d44cbf0904038.jpg,Nissan,QuantitativeValue,47530,Murano,Certified 2015 Nissan Murano Platinum,Offer,http://schema.org/InStock,http://schema.org/CertifiedCondition,19875,USD,2015,https://www.autotrader.com/cars-for-sale/vehicledetails.xhtml?listingId=527086431,6-Cylinder,5N1AZ2MH7FN206462,Black,Automatic
553,http://schema.org/,Car,Used,"New York, NY",,,Jeep,Red,"Location: New York, NY. This 2015 Jeep Wrangler is listed for $27700",4 wheel drive,https://images.autotrader.com/hn/c/e10bd13eb58044d8842004309dc3ff66.jpg,Jeep,QuantitativeValue,45597,Wrangler,Used 2015 Jeep Wrangler 4WD Rubicon,Offer,http://schema.org/InStock,http://schema.org/USEDCondition,27700,USD,2015,https://www.autotrader.com/cars-for-sale/vehicledetails.xhtml?listingId=540331709,6-Cylinder,1C4BJWCG0FL750765,,
554,http://schema.org/,Car,Certified,"New York, NY",,,Honda,Red,"Location: New York, NY. This 2015 Honda Accord is listed for $15190",2 wheel drive - front,https://images.autotrader.com/hn/c/ffb58722468e476ebead58e097d67d06.jpg,Honda,QuantitativeValue,61077,Accord,Certified 2015 Honda Accord EX-L Sedan,Offer,http://schema.org/InStock,http://schema.org/CERTIFIEDCondition,15190,USD,2015,https://www.autotrader.com/cars-for-sale/vehicledetails.xhtml?listingId=533557682,4-Cylinder,1HGCR2F80FA046864,,
555,http://schema.org/,Car,Used,"New York, NY","4-Wheel Disc Brakes, 6 Speakers, ABS brakes, AM/FM radio, Air Conditioning, Auto-dimming Rear-View mirror, Brake assist, Bumpers: body-color",Coupe,Ford,Gray,"Location: New York, NY. This 2015 Ford Mustang includes 4-Wheel Disc Brakes, 6 Speakers, ABS brakes, AM/FM radio, Air Conditioning, Auto-dimming Rear-View mirror, Brake assist, Bumpers: body-color",2 wheel drive - rear,,Ford,QuantitativeValue,42424,Mustang,Used 2015 Ford Mustang Coupe,Offer,http://schema.org/InStock,http://schema.org/UsedCondition,15105,USD,2015,https://www.autotrader.com/cars-for-sale/vehicledetails.xhtml?listingId=542079479,6-Cylinder,1FA6P8AM2F5347577,Ebony,Manual
556,http://schema.org/,Car,Certified,"New York, NY","16"" x 7.0"" Steel w/Full Covers Wheels, 4-Wheel Disc Brakes, 6 Speakers, ABS brakes, AM/FM radio, AM/FM/CD/MP3 Audio System, Air Conditioning",Sedan,Nissan,White,"Location: New York, NY. This 2015 Nissan Altima includes 16"" x 7.0"" Steel w/Full Covers Wheels, 4-Wheel Disc Brakes, 6 Speakers, ABS brakes, AM/FM radio, AM/FM/CD/MP3 Audio System, Air Conditioning",2 wheel drive - front,https://images.autotrader.com/hn/c/f08ce83a40414735a162f1e05963b15e.jpg,Nissan,QuantitativeValue,74806,Altima,Certified 2015 Nissan Altima 2.5 S,Offer,http://schema.org/InStock,http://schema.org/CertifiedCondition,10665,USD,2015,https://www.autotrader.com/cars-for-sale/vehicledetails.xhtml?listingId=521968340,4-Cylinder,1N4AL3AP6FN366572,Charcoal,Automatic
557,http://schema.org/,Car,Used,"New York, NY","2 Seatback Storage Pockets, 3 12V DC Power Outlets, 4-Wheel Disc Brakes, 40-60 Folding Bench Front Facing Rear Seat, 5 Person Seating Capacity",Sedan,Maserati,Blue,"Location: New York, NY. This 2015 Maserati Ghibli includes 2 Seatback Storage Pockets, 3 12V DC Power Outlets, 4-Wheel Disc Brakes, 40-60 Folding Bench Front Facing Rear Seat, 5 Person Seating Capacity",All wheel drive,https://images.autotrader.com/hn/c/028ac769b83c4e2cab6d785df56b4543.jpg,Maserati,QuantitativeValue,44121,Ghibli,Used 2015 Maserati Ghibli S Q4,Offer,http://schema.org/InStock,http://schema.org/UsedCondition,29999,USD,2015,https://www.autotrader.com/cars-for-sale/vehicledetails.xhtml?listingId=509855586,6-Cylinder Turbo,ZAM57RTA4F1130808,,Automatic
